Source,Url,Text
HANNITY,https://www.hannity.com/media-room/trump-unleashed-the-president-calls-out-congressional-democrats-with-one-simple-question/,"TRUMP UNLEASHED: The President Calls-Out Congressional Democrats with ONE Simple QuestionPresident Trump unloaded on Congressional Democrats Monday morning as the partial government shutdown entered its fifth week; asking the American people how the Democrat-controlled House of Representatives was  working out  for the country. Democrats campaigned on working within Washington and  getting things done!  How is that working out? #2020TAKEBACKTHEHOUSE,  asked the Commander-in-Chief on social media.Democrats campaigned on working within Washington and  getting things done!  How is that working out? #2020TAKEBACKTHEHOUSE  Donald J. Trump (@realDonaldTrump) January 21, 2019The president s comments come days after he offered a compromise immigration package to Democratic leadership; saying he was willing to expand DACA coverage to the nation s  Dreamers  in exchange for $5.7 billion in border wall funding."
HANNITY,https://www.hannity.com/media-room/union-confusion-white-house-plans-to-go-ahead-with-state-of-the-union-despite-pelosi/,"UNION CONFUSION: White House Plans to Go Ahead with State of the Union Despite PelosiThe White House is reportedly planning to hold the annual State of the Union address as previously planned; ignoring Speaker Nancy Pelosi s insistence the speech be delayed due to the ongoing government shutdown. The White House is still planning to move ahead with next week s scheduled State of the Union address, but the details remain up in the air after House Speaker Nancy Pelosi strongly urged the president to delay the speech or submit it in writing amid the government shutdown fight,  writes Fox News. Sadly, given the security concerns and unless the government re-opens this week, I suggest that we work together to determine another suitable date after government has re-opened for this address or for you to consider delivering your State of the Union address in writing to Congress on January 29,  Pelosi wrote in a letter last week. We are still in a holding pattern,  one senior source said.Read the full report at Fox News."
HANNITY,https://www.hannity.com/media-room/fund-the-wall-trump-refuses-to-back-budget-deal-without-border-wall-funding/,"FUND THE WALL: Trump Refuses to Back Budget Deal without Border Wall FundingPresident Trump told congressional leaders Thursday that he will not sign a budget agreement that fails to include funding for his border wall; increasing the likelihood of a partial  government shutdown  heading towards Friday s deadline. House Speaker Paul Ryan, R-Wis., and House Majority Leader Kevin McCarthy, R-Calif., told reporters after meeting the president at the White House Thursday afternoon that Trump told them he will not sign the stopgap spending measure,  writes Fox News. What we re going to do is go back to the House and work with our members,  Ryan said.  We want to keep the government open but we also want to see an agreement that protects the border. We have very serious concerns about securing our border.  The president said what the Senate sent over is just kicking the can down the road,  McCarthy said.  We want to solve this problem. Read the full report at Fox News."
HANNITY,https://www.hannity.com/media-room/graham-slam-sen-graham-blasts-absurd-petty-and-shameful-nancy-pelosi/,"GRAHAM SLAM: Sen. Graham BLASTS  Absurd, Petty, and Shameful  Nancy PelosiSenator Lindsey Graham stopped by  Hannity  Wednesday night to weigh-in on the five-week long government shutdown; saying the President made a  brilliant political move  by moving towards the center on border security. How can anybody look in the eye of a parent who lost a kid to a heroin overdose, and say:  This is manufactured?  Or look in the face of an angel mom or dad?  asked Hannity. What you don t have is clips of Democratic Senators saying this because they know it s a death blow to the party. President Trump made a brilliant political move, and good for the country, to go to the middle,  said Graham. The harder Nancy Pelosi goes left, and the more Trump goes to the middle, we re going to get this thing solved,  he added.Watch Sen. Graham on  Hannity  above."
HANNITY,https://www.hannity.com/media-room/pelosi-responds-nancy-pelosi-responds-to-president-trumps-immigration-compromise/,"PELOSI RESPONDS: Nancy Pelosi Responds to President Trump s Immigration CompromiseSpeaker of the House Nancy Pelosi responded to President Trump s border security compromise Saturday evening; saying the Commander-in-Chief has  no sympathy  for those impacted by the partial government shutdown. What is original in the President s proposal is not good. What is good in the proposal is not original. Democrats will vote next week to add additional border security funding for ports of entry, advanced technology for scanning vehicles for drugs & immigration judges,  posted Pelosi on social media.What is original in the President s proposal is not good. What is good in the proposal is not original. Democrats will vote next week to add additional border security funding for ports of entry, advanced technology for scanning vehicles for drugs & immigration judges.  Nancy Pelosi (@SpeakerPelosi) January 19, 2019 What we didn t hear from the President was any sympathy for the federal workers who face so much uncertainty because of the chaos of the #TrumpShutdown,  she added."
HANNITY,https://www.hannity.com/media-room/watch-live-president-trump-addresses-the-nation-from-the-oval-office/,"WATCH LIVE: President Trump Addresses the Nation from the Oval OfficePresident Trump is poised to deliver his first prime-time address from the Oval Office since his inauguration Tuesday evening; speaking directly to the American people about the ongoing government shutdown and the nation s security along the US-Mexico border.The address comes as the second-longest government shutdown in America s history enters its third week, with both Democrats and Republicans digging-in on President s signature campaign promise: a physical barrier along the United States  southern border.Watch President Trump s address below:"
HANNITY,https://www.hannity.com/media-room/no-cave-trump-rallies-gop-legislators-to-stay-strong-on-border-wall-funding/," NO CAVE! : Trump Rallies GOP Legislators to Stay Strong on Border Wall FundingPresident Trump rallied Republican lawmakers on social media Tuesday morning; telling the GOP legislators not to  cave  to Democrats  demands that they re-open the federal government without funding for border security. Without a Wall our Country can never have Border or National Security. With a powerful Wall or Steel Barrier, Crime Rates (and Drugs) will go substantially down all over the U.S. The Dems know this but want to play political games. Must finally be done correctly. No Cave!  tweeted the Commander-in-Chief.Without a Wall our Country can never have Border or National Security. With a powerful Wall or Steel Barrier, Crime Rates (and Drugs) will go substantially down all over the U.S. The Dems know this but want to play political games. Must finally be done correctly. No Cave!  Donald J. Trump (@realDonaldTrump) January 22, 2019The President s post comes as the partial federal government shutdown entered its 32nd day; the longest shutdown in American history."
HANNITY,https://www.hannity.com/media-room/media-meltdown-cnns-acosta-slams-trumps-childish-move-to-cancel-pelosis-trip/,"MEDIA MELTDOWN: CNN s Acosta Slams Trump s  Childish  Move to Cancel Pelosi s TripCNN senior White House correspondent Jim Acosta continued his all-out war with the White House Thursday; calling the President s decision to cancel Speaker Pelosi s foreign trip during the government shutdown a  childish response. Video: Behold the latest Jim @Acosta meltdown! He lost his mind over Trump cancelling Pelosi s overseas trip, calling it a sign that D.C. is  a playground  and that Trump s being  childish  and  not really a serious response  pic.twitter.com/r7MekcGFxr  Curtis Houck (@CurtisHouck) January 17, 2019 Our nation s capital has officially become a playground. Our President has responded in a childish way to the House Speaker s letter; essentially saying the State of the Union be postponed,  said Acosta. He s calling upon the Speaker to join his strong border security movement -as he s calling it- to end the shutdown,  he added."
HANNITY,https://www.hannity.com/media-room/hannity-what-is-nancy-pelosi-fighting-for/,"HANNITY: What is Nancy Pelosi Fighting For?Speaking during his opening monologue on  Hannity  Thursday night; Sean slammed House Speaker Nancy Pelosi for playing  petty political games  as the partial government shutdown finishes its fifth week. House Speaker Nancy Pelosi is playing petty political games with the nation, the State of the Union, the President. What is she fighting for? The President is fighting life and death, he s fighting for safety and security,  said Hannity. She refused to compromise on budget negotiations  She s been too busy on her luxurious vacations  To even talk to the President -who s offered dramatic compromises- she has no time for that,  he added.Watch Hannity s opening monologue above."
HANNITY,https://www.hannity.com/media-room/its-on-president-trump-vows-to-deliver-state-of-the-union-in-pelosis-house-of-representatives/,"IT S ON: President Trump Vows to Deliver State of the Union in Pelosi s House of RepresentativesPresident Trump vowed Wednesday to deliver his annual State of the Union address inside the House of Representatives; saying he will make his speech  on time, on schedule, and very importantly, on location.  I will be honoring your invitation, and fulfilling my Constitutional duty, to deliver important information to the people and Congress of the United States of America regarding the State of our Union,  wrote Trump in a letter to Speaker Pelosi. I look forward to seeing you on the evening on January 29th in the Chamber of the House of Representatives. It would be so very sad for our country if the State of the Union were not delivered on time, on schedule, and very importantly, on location!  he added.Last week, Pelosi urged the President to delay his annual address until both parties resolve the five-week long government shutdown.Read the full story at Fox News."
HANNITY,https://www.hannity.com/media-room/who-cares-president-trump-dismisses-ocasio-cortez-recent-attacks/," WHO CARES?  President Trump Dismisses Ocasio-Cortez  Recent AttacksPresident Trump totally dismissed recent critiques from Rep. Alexandria Ocasio-Cortez Monday; asking reporters  who cares  when pressed on her vicious claims the Commander-in-Chief was an outright racist.The President was speaking from the White House lawn Monday over the ongoing government shutdown when one reporter asked him to weigh-in on the self-described Democratic-Socialist s hateful rhetoric.Trump responds to Ocasio-Cortez calling him a racistReporter:  Mr. President, congresswoman Ocasio-Cortez called you a racist Trump:  Who did? Reporter:  Congresswoman Ocasio-Cortez Trump:  Who cares  pic.twitter.com/Wh5x6ZXYwb  Ryan Saavedra (@RealSaavedra) January 14, 2019 Mr. President, congresswoman Ocasio-Cortez called you a racist,  yelled one journalist. Who cares? Geez,  replied the President."
HANNITY,https://www.hannity.com/media-room/graham-on-hannity-democrats-oppose-border-wall-because-they-want-trump-to-fail/,"GRAHAM ON HANNITY: Democrats Oppose Border Wall  Because They Want Trump to Fail Sen. Lindsey Graham stopped by  Hannity  Wednesday night to weigh-in on the partial government shutdown; saying Democrats  refuse to give a dime  to President Trump simply  because they want him to fail.  It makes my blood boil because this is happening time and again. We had people that didn t respect our laws or our sovereignty come to America, commit more crimes, they re in custody, then they re protected from the laws of the land,  said Hannity. These policies make it more likely that terrorists, drug dealers, and criminals can come to America and have a safe haven  Democrats are for border security, except when Trump s president. I ve seen them in action. They won t give a dime to this president because they want him to fail,  fired-back Graham.Watch Sen. Graham on  Hannity  above."
HANNITY,https://www.hannity.com/media-room/bobs-rebuke-sen-menendez-slams-fox-news-for-reporting-on-democrats-puerto-rico-vacation/,"BOB S REBUKE: Sen. Menendez Slams FOX NEWS for Reporting on Democrats  Puerto Rico VacationSen. Bob Menendez slammed Fox News Tuesday for reporting on congressional Democrats  recent tropical retreat during the ongoing government shutdown; saying the network s coverage  was neither fair nor balanced  in covering the lawmakers  Puerto Rican visit. You could have had hours and hours and hours of meetings and you chose one thing for an hour,  said the legislator after an employee of the network posted in image of Menendez on the beach as thousands of federal workers went unpaid.Sen. Menendez lashes out at Fox News for beach photo:  You re neither fair nor balanced  https://t.co/IORcA5wAOm  The Washington Times (@WashTimes) January 15, 2019 You guys are not fair,  said the Senator.  You re neither fair nor balanced. So, thank you. Read the full report at the Washington Times."
HANNITY,https://www.hannity.com/media-room/more-cracks-growing-chorus-of-democrats-urge-pelosi-to-negotiate-on-border-wall/,"MORE CRACKS? Growing Chorus of Democrats Urge Pelosi to Negotiate on Border WallA growing list of centrist Democrats are calling-on Speaker of the House Nancy Pelosi to negotiate with the White House on border security; saying she must work towards ending the five-week long government shutdown. Democratic leaders in Congress say they have no interest in making a deal with President Trump to end the government shutdown if it includes new money for his border wall,  writes Fox News. But cracks within the Trump resistance are starting to show, with Democratic lawmakers and influential liberal opinion makers imploring House Speaker Nancy Pelosi and Senate Democratic Leader Chuck Schumer to at least meet Trump at the negotiating table. Some are even arguing they should agree to border wall funds,  adds Fox. Give Trump the money,  Minnesota Democratic Rep. Collin Peterson said on local radio Tuesday.  I d give him the whole thing and put strings on it so you make sure he puts the wall where it needs to be. Why are we fighting over this? We re going to build that wall anyway, at some time. Read the full report at Fox News."
HANNITY,https://www.hannity.com/media-room/trump-to-texas-the-president-plans-to-hold-his-first-political-rally-of-2019-in-el-paso/,"TRUMP TO TEXAS: The President Plans to Hold His First Political Rally of 2019 in EL PASOPresident Trump announced this week his plans to hold his first political rally of 2019 in the border city of El Paso, Texas in the coming days; highlighting the escalating crisis taking place along the porous southern border with Mexico. The rally, scheduled for Monday, comes amid ongoing negotiations between Trump and congressional Democrats as the president tries to secure more than $5 billion in funding for his long-promised border wall,  reports The Hill. The border city of El Paso, Texas, used to have extremely high rates of violent crime   one of the highest in the country, and considered one of our nation s most dangerous cities,  said the President during his State of the Union address Tuesday.  Now, with a powerful barrier in place, El Paso is one of our safest cities. The event will take place just days before a February 15th deadline, when congressional leaders must pass a bipartisan budget agreement that funds the President s border wall or face another potential government shutdown.Read the full report here."
HANNITY,https://www.hannity.com/media-room/fireworks-trump-unloads-on-pelosi-schumer-over-border-wall-in-fiery-exchange/,"FIREWORKS: Trump UNLOADS on Pelosi, Schumer Over Border Wall in Fiery ExchangePresident Trump unloaded on House Minority Leader Nancy Pelosi and Senate Minority Leader Chuck Schumer Tuesday; blasting the top Democrats for their inability to secure funding for his proposed border wall.The Commander-in-Chief was hosting a high-stakes discussion with the Democratic leadership at the White House where he vowed to  shut down  the government should they fail to reach an agreement. Nancy is in a situation where it s not easy for her to talk right now,  Trump says of Pelosi. Don t characterize the strength I bring to this meeting,  Pelosi fires back. MORE: https://t.co/eaJlc14j6b pic.twitter.com/Np5syH6LDH  Washington Examiner (@dcexaminer) December 11, 2018Trump, Pelosi and Schumer devolve into shouting match over the wall in Oval Office meeting, with Trump asserting:  I am proud to shut down the government for border security, Chuck  I will be the one to shut it down  https://t.co/7kP3zbH1DL pic.twitter.com/BDRVNWZegM  The Daily Beast (@thedailybeast) December 11, 2018 If there s not border security, I won t take it!  Trump confirmed.  I am proud to shut down the government for border security.  I will take the mantle,  he added.  I will be the one to shut it down. And I m gonna shut it down for border security. "
HANNITY,https://www.hannity.com/media-room/update-president-trump-says-hell-deliver-state-of-the-union-when-shutdown-over/,"UPDATE: President Trump Says He ll Deliver State of the Union  When Shutdown Over President Trump confirmed Wednesday night he plans to delay his annual State of the Union address until after the federal government re-opens in the coming weeks; saying he ll speak to the American people when the  shutdown is over.  As the Shutdown was going on, Nancy Pelosi asked me to give the State of the Union Address. I agreed. She then changed her mind because of the Shutdown, suggesting a later date. This is her prerogative ñ I will do the Address when the Shutdown is over. I am not looking for an alternative venue for the SOTU Address because there is no venue that can compete with the history, tradition and importance of the House Chamber. I look forward to giving a  great  State of the Union Address in the near future!  tweeted the Commander-in-Chief.As the Shutdown was going on, Nancy Pelosi asked me to give the State of the Union Address. I agreed. She then changed her mind because of the Shutdown, suggesting a later date. This is her prerogative ñ I will do the Address when the Shutdown is over. I am not looking for an .  Donald J. Trump (@realDonaldTrump) January 24, 2019 .alternative venue for the SOTU Address because there is no venue that can compete with the history, tradition and importance of the House Chamber. I look forward to giving a  great  State of the Union Address in the near future!  Donald J. Trump (@realDonaldTrump) January 24, 2019Read the full story at Fox News."
HANNITY,https://www.hannity.com/media-room/critical-situation-trump-summons-leaders-to-situation-room-for-budget-showdown/,"CRITICAL SITUATION: Trump Summons Leaders to Situation Room for Budget ShowdownPresident Trump summoned congressional leaders to the White House s Situation Room Wednesday; demanding Democrats and Republicans fully fund his border security initiatives and re-open the federal government. President Trump plans to hold a highly anticipated border security meeting with congressional leaders in the Situation Room on Wednesday afternoon, Fox News has learned   choosing a setting meant to underscore the urgency of the border problem,  writes Fox.The federal government effectively shutdown December 22nd after congressional Democrats called the president s border wall funding a  non-starter  in budget negotiations.The high-stakes meeting comes just hours before Democrats retake control of the House of Representatives, when House Minority Leader Nancy Pelosi is widely expected to become the next Speaker of the House.Read the full report at Fox News."
HANNITY,https://www.hannity.com/media-room/nancys-nightmare-rand-paul-proposes-moving-state-of-the-union-address-to-us-senate/,"NANCY S NIGHTMARE: Rand Paul Proposes Moving  State of the Union  Address to US SenateSen. Rand Paul directly rebuked Speaker Nancy Pelosi s recent comments that suggested President Trump delay his annual State of the Union address; urging the Commander-in-Chief to hold the event in the United States Senate. Senator McConnell is in charge of the Senate. If Mrs. Pelosi refuses to allow the president to deliver the State of the Union in the House, I propose we move it to the Senate and make it happen!  tweeted Paul.Senator McConnell is in charge of the Senate. If Mrs. Pelosi refuses to allow the president to deliver the State of the Union in the House, I propose we move it to the Senate and make it happen!  Senator Rand Paul (@RandPaul) January 17, 2019Pelosi cited  security concerns  for the event; baselessly claiming the partial government shutdown could make the address a dangerous situation for politicians and guests."
HANNITY,https://www.hannity.com/media-room/dear-nancy-wives-of-border-patrol-agents-invite-speaker-pelosi-to-tour-border-towns/,"DEAR NANCY: Wives of Border Patrol Agents Invite Speaker Pelosi to Tour Border TownsA group of Border Patrol wives officially invited House Speaker Nancy Pelosi to personally tour a series of Texas towns this week; saying they would like to  cordially invite you to come to McAllen, TX as President Trump did.  We the WIVES OF THE RGV (Rio Grande Valley) BP (Border Patrol) would like to cordially invite you to come visit McAllen, TX as President Trump did. It appears you are not busy today or any day, until Tuesday when you will return from your 4 day vacation,  posted the group on social media last Thursday -one day before the end of the longest government shutdown in American history. We d also appreciate if you d stop pretending that you care about federal workers. If you did, you would care for their safety, not just their paychecks. We can hold out a while longer if it means our husbands and communities are safer,  added the statement. I felt it s really important to have our leaders come here and see what s happening first. It s important to meet with the people who are here on a daily basis, that are witnessing it ñ the effects of it, that it has on our country,  one of the wives told Fox News.Read the full repot here."
HANNITY,https://www.hannity.com/media-room/developing-president-trump-walks-away-calls-budget-meeting-total-waste-of-time/,"DEVELOPING: President Trump WALKS AWAY, Calls Budget Meeting  Total Waste of Time President Trump abruptly left a high-stakes budget meeting with Sen. Chuck Schumer and Rep. Nancy Pelosi in Washington Wednesday; calling the negotiations a  total waste of time  after the Speaker said she has no plans on funding his proposed border wall. Just left a meeting with Chuck and Nancy, a total waste of time. I asked what is going to happen in 30 days if I quickly open things up, are you going to approve Border Security which includes a Wall or Steel Barrier? Nancy said, NO. I said bye-bye, nothing else works!  the president confirmed on social media.Just left a meeting with Chuck and Nancy, a total waste of time. I asked what is going to happen in 30 days if I quickly open things up, are you going to approve Border Security which includes a Wall or Steel Barrier? Nancy said, NO. I said bye-bye, nothing else works!  Donald J. Trump (@realDonaldTrump) January 9, 2019The meeting comes just hours after President Trump directly addressed the American people Tuesday night; calling on Democrats to fully fund his border security initiatives and re-open the federal government."
HANNITY,https://www.hannity.com/media-room/report-bernie-sanders-to-introduce-legislation-to-double-federal-minimum-wage/,"REPORT: Bernie Sanders to Introduce Legislation to DOUBLE Federal Minimum WageVermont Senator and potential 2020 candidate Bernie Sanders will introduce legislation in the coming days to drastically increase the federal minimum wage; setting the stage for a high-stakes showdown with Congressional Republicans heading into the 2020 election season. The federal minimum wage of $7.25 is a starvation wage. That is why I, along with many other members of Congress, will introduce legislation this week to raise that wage to $15 an hour. If you work 40 hours a week, you should not live in poverty,  Sanders posted on social media.The federal minimum wage of $7.25 is a starvation wage. That is why I, along with many other members of Congress, will introduce legislation this week to raise that wage to $15 an hour. If you work 40 hours a week, you should not live in poverty.  Bernie Sanders (@SenSanders) January 14, 2019The bill comes as the federal government shutdown enters its fourth week; becoming the longest shutdown in US history."
