Source,Url,Text
HANNITY,https://www.hannity.com/media-room/plan-b-schumer-introduces-legislation-to-make-sure-we-never-have-another-shutdown/,"PLAN B: Schumer Introduces Legislation to  Make Sure We Never Have Another Shutdown Sen. Minority Leader Chuck Schumer introduced legislation over the weekend that would effectively ban potential government shutdowns in the near future; saying a Democrat proposal would  make sure we never have another shutdown again. Chuck Schumer:  I am announcing today that I am supporting legislation that will make sure we never have another shutdown again.  pic.twitter.com/F4ZcpmtQ5C  The Hill (@thehill) January 28, 2019 I am announcing today that I m supporting legislation that will make sure we never have another shutdown again. And if the President and Congress can t reach an agreement, federal workers are still paid at the levels they have always been paid,  said Schumer. We can pass that legislation, it will mean above all that federal workers will not be hurt again and will also eliminate the incentive for anyone to use the shutdown as a tool to get what they want,  he added.Watch Schumer s comments above."
HANNITY,https://www.hannity.com/media-room/who-cares-speaker-pelosi-bizarrely-claims-state-of-the-union-unimportant-for-most-americans/,"WHO CARES? Speaker Pelosi Bizarrely Claims State of the Union  Unimportant  for Most AmericansSpeaker of the House Nancy Pelosi bizarrely slammed the President s annual State of the Union Address Thursday; saying the Commander-in-Chief s national speech is largely  unimportant  for average Americans. Last night the president accepted the fact that the State of the Union should be at a time when government is not shut down. I m glad we could get that off the table. It is so unimportant in the lives of the American people in terms of especially those who are victims of the shutdown, hostages to the president s applause line in a campaign speech,  Pelosi said during her weekly press briefing.Nancy Pelosi says Pres. Trump  accepted the fact  that State of the Union won t be held until after shutdown. I m glad we could get that off the table It is so unimportant in the lives of the American people, especially those who are victims of the shutdown.  pic.twitter.com/UqEilv7gy3  ABC News Politics (@ABCPolitics) January 24, 2019 Thank goodness we have put that matter to rest and we can get on to the subject at hand, open up government so we can negotiate how best to protect our borders,  she added."
HANNITY,https://www.hannity.com/media-room/dems-caving-centrist-democrats-urge-pelosi-to-strike-a-deal-with-trump-on-border/,"DEMS CAVING? Centrist Democrats Urge Pelosi to Strike a Deal with Trump on BorderSeveral centrist Democrats called on Speaker of the House Nancy Pelosi to make a counteroffer to President Trump s immigration compromise proposal; saying the left-wing leader needs to end the partial government shutdown.The group of moderate lawmakers urged Pelosi to schedule a full vote on the president s border wall proposal in February should they vote to re-open the government. We understand that this shutdown was not caused by the 116th Congress, but it is our job to fix it,  said a statement from the group. We promised our constituents that we would seek bipartisan solutions, and we feel that this proposal would gain bipartisan support and allow a transparent process to evaluate the true needs of border security and provide much-needed reform to our immigration process,  added the letter.Over the weekend, the President unveiled his immigration compromise; saying he was prepared to extend DACA protections to the nation s  Dreamers  in exchange for $5.7 billion in border wall funding.Read the full report at Politico."
HANNITY,https://www.hannity.com/media-room/week-5-trump-praises-patriotic-federal-workers-going-without-pay-during-shutdown/,"WEEK 5: Trump Praises  Patriotic  Federal Workers Going  Without Pay  During ShutdownPresident Trump thanked  patriotic  federal employees Sunday evening as the partial government shutdown entered its fifth week; saying Republicans and Democrats must work together to solve the nation s escalating border crisis. To all of the great people who are working so hard for your Country and not getting paid I say, THANK YOU ñ YOU ARE GREAT PATRIOTS! We must now work together, after decades of abuse, to finally fix the Humanitarian, Criminal & Drug Crisis at our Border. WE WILL WIN BIG!  Trump tweeted on social media.To all of the great people who are working so hard for your Country and not getting paid I say, THANK YOU ñ YOU ARE GREAT PATRIOTS! We must now work together, after decades of abuse, to finally fix the Humanitarian, Criminal & Drug Crisis at our Border. WE WILL WIN BIG!  Donald J. Trump (@realDonaldTrump) January 21, 2019The President s comments come hours after he offered a compromise immigration package to Congressional Democrats; agreeing to extend DACA protections in exchange for $5.7 billion in border wall funding. "
HANNITY,https://www.hannity.com/media-room/dems-denied-white-house-says-congress-cant-use-government-aircraft-during-shutdown/,"DEMS DENIED! White House Says Congress Can t Use  Government Aircraft  During ShutdownA letter released from the Office of Budget Management Friday confirmed members of Congress are prohibited from using  government aircraft  during a federal shutdown; saying all legislators and their staff need  White House approval  for air travel. In light of the current partial government shutdown, the President has asked me to direct the heads of all executive departments and agencies of the Administration on new policies in support of Legislative Branch travel,  reads the statement.Looks like Pelosi travels heavy https://t.co/i2yDUCld1W  Mark R. Levin (@marklevinshow) January 18, 2019 Under no circumstances during a government shutdown will any government owned, rented, leased, or chartered aircraft support any Congressional delegation, without the express written approval of the White House Chief of Staff,  adds the letter.The statement comes hours after President Trump abruptly canceled Speaker Pelosi s overseas trip; demanding the Democratic leader remain in Washington and re-open the federal government.Read the full statement here."
HANNITY,https://www.hannity.com/media-room/hannity-pelosis-intercontinental-trip-shows-shes-not-serious-about-gov-shutdown/,"HANNITY: Pelosi s  Intercontinental Trip  Shows She s Not Serious About Gov ShutdownSpeaking during his opening monologue on  Hannity  Thursday night, Sean slammed Speaker Pelosi s  postponed  international trip in the midst of a partial government shutdown; saying the liberal leader was playing petty political games. In the middle of a partial government shutdown, Speaker Nancy Pelosi was all set to leave on a military plane, on your dime, and embark on a seven-day excursion with other Democratic members of Congress,  said Hannity. That s until President Trump pulled the plug  Keep in mind this letter comes 24-hours after Speaker Pelosi called for the State of the Union to be canceled. She was perfectly happy to take a government-funded intercontinental trip instead of staying in Washington, DC and doing her job,  he added.Watch Hannity s opening monologue above."
HANNITY,https://www.hannity.com/media-room/great-question-trump-asks-why-pelosi-is-still-getting-paid-during-gov-shutdown/,"GREAT QUESTION: Trump Asks Why Pelosi is Still  Getting Paid  During Gov ShutdownPresident Trump took his war-of-words with Speaker Nancy Pelosi to the next level Tuesday; asking why the Democratic leader continues to receive her government salary as thousands of federal workers go without pay. Why is Nancy Pelosi getting paid when people who are working are not?  pondered the president on social media.Why is Nancy Pelosi getting paid when people who are working are not?  Donald J. Trump (@realDonaldTrump) January 15, 2019Pelosi and House Democrats found themselves in hot-water with American workers over the weekend; jetting to a tropical retreat in Puerto Rico as thousands went without pay throughout the country."
HANNITY,https://www.hannity.com/media-room/bad-vacation-trump-slams-top-democrats-for-celebrating-shutdown-in-puerto-rico/,"BAD VACATION: Trump Slams Top Democrats for  Celebrating Shutdown  in Puerto RicoPresident Trump didn t mince words when commenting on the Democrats  recent trip to Puerto Rico Monday; saying he was in the nation s capital  all weekend  while liberal lawmakers were  celebrating  the shutdown on a tropical beach.President Trump:  I ve been here all weekend. A lot of the Democrats were in Puerto Rico celebrating something. I don t know. Maybe they re celebrating the #shutdown.  pic.twitter.com/iZoixGG0Ro  CSPAN (@cspan) January 14, 2019 I ve been here all weekend. A lot of the Democrats were in Puerto Rico celebrating something. I don t know, maybe they re celebrating the shutdown. We have a very big crisis on the border. Everybody knows it, they know it,  said the president. The Republicans are rock solid, we ve got to take care of our border. Many of the people that aren t being paid right now are in total agreement with us,  he added.Watch the President s comments above."
HANNITY,https://www.hannity.com/media-room/sarah-smackdown-huckabee-sanders-roasts-democrats-for-beach-vacation-during-shutdown/,"SARAH SMACKDOWN: Huckabee Sanders ROASTS Democrats for  Beach Vacation  During ShutdownWhite House Press Secretary Sarah Huckabee Sanders unloaded on congressional Democrats over the weekend; blasting the left-wing lawmakers for  partying on the beach  as the federal government shutdown entered its fourth week. Democrats in Congress are so alarmed about federal workers not getting paid they re partying on the beach instead of negotiating a compromise to reopen the government and secure the border,  she posted on social media.Democrats in Congress are so alarmed about federal workers not getting paid they re partying on the beach instead of negotiating a compromise to reopen the government and secure the borderhttps://t.co/zpJypJ2Slq  Sarah Sanders (@PressSec) January 13, 2019Sanders  comments come hours after approximately 30 Democratic members chartered a jet and flew to Puerto Rico to take part in the annual Congressional Hispanic Caucus BOLD PAC gathering.Read the full report at Fox News."
HANNITY,https://www.hannity.com/media-room/pelosi-shutdown-vacation-ok-because-hawaii-is-a-part-of-the-united-states/,"PELOSI: Shutdown Vacation OK Because  Hawaii is a Part of the United States California congresswoman and likely Speaker of the House Nancy Pelosi defended her tropical vacation during the government shutdown this week; saying her Christmas trip was appropriate because Hawaii is technically a part of the United States.Pelosi was speaking with NBC News when she was asked to comment on President Trump s  swipe  about her taking a lavish holiday trip while thousands of federal workers went without pay throughout the country.Nancy Pelosi Defends Vacation During Shutdown: Trump May Not Know  Hawaii is Part of the United States  https://t.co/IiO5LDzEN7 pic.twitter.com/LLd4T0akbE  Mediaite (@Mediaite) January 3, 2019 I observed the Christmas holiday for a few days  and in fact cut in half the time I would have had with my family. It s totally unimportant. The fact is we all stood ready and told our members we have 24 hours  notice to be where we need to be,  said Pelosi. The President may not know this, but Hawaii is part of the United States of America. Maybe he doesn t realize that,  she added."
HANNITY,https://www.hannity.com/media-room/nasty-in-ny-de-blasio-slams-sad-shutdown-says-nyc-will-continue-to-function/,"NASTY IN NY: De Blasio Slams  Sad  Shutdown, Says NYC Will  Continue to Function New York City Mayor Bill de Blasio weighed-in Monday on the federal government s partial shutdown over border security; calling the development a  sad moment for America  but reassuring Big Apple residents their  city government  will  continue to function.  [President Trump s] shutdown is a sad moment for America. But I can assure the people of New York City that their city government will continue to function,  posted de Blasio on social media..@realDonaldTrump s shutdown is a sad moment for America. But I can assure the people of New York City that their city government will continue to function. pic.twitter.com/Lsl2inOTlr  Mayor Bill de Blasio (@NYCMayor) December 24, 2018De Blasio s comments come just weeks after a mild, seasonally average snowstorm brought the nation s largest city to a total standstill; with residents calling for the mayor to resign after countless New Yorkers were stuck in snarled traffic for upwards of seven hours."
HANNITY,https://www.hannity.com/media-room/final-warning-trump-tells-dems-hes-totally-prepared-for-a-very-long-shutdown/,"FINAL WARNING: Trump Tells Dems He s  TOTALLY PREPARED  for a  Very Long Shutdown President Trump warned Congressional leaders Friday that the White House was  totally prepared  for a  very long shutdown  should they fail to reach a budget deal; saying this may be  our only chance  to get  great border security. The President was speaking with reporters during a signing ceremony for his Criminal Reform Justice Bill when he weighed-in on the potential shutdown as the Friday deadline loomed closer. We re totally prepared for a very long shutdown,  Pres. Trump says.  This is our only chance that we ll ever have to get great border security. https://t.co/W46TRJrB0j pic.twitter.com/8w9zTItHOG  ABC News (@ABC) December 21, 2018 Now it s up to the Democrats as to whether or not we have a shutdown tonight. I hope we don t, but we re totally prepared for a very long shutdown. This is our only chance that we ll ever have because of the world and the way it works out, to get great border security,  said the president."
HANNITY,https://www.hannity.com/media-room/shutdown-delayed-mcconnell-says-us-needs-government-to-remain-open/,"SHUTDOWN DELAYED? McConnell Says US Needs  Government to Remain Open The US Senate plans to introduce a short-term spending bill to keep the federal government open for business Wednesday; delaying a full budget vote until February 8th as legislators struggle to reach an agreement surrounding border security. The bill would fund the government through Feb. 8, Senate Majority Leader Mitch McConnell announced. The Senate will take up the measure later Wednesday, the Kentucky Republican said. Lawmakers need to pass spending bills by midnight Friday to avoid a partial shutdown,  writes CNBC. We need the government to remain open for the American people,  McConnell told his fellow lawmakers. A White House spokesman did not immediately respond to a request to comment on whether Trump would back a short-term spending bill. On Tuesday, White House press secretary Sarah Huckabee Sanders said the president would want to see what Congress passes before he decides whether to sign it,  adds the article.Read the full story at CNBC."
HANNITY,https://www.hannity.com/media-room/tick-tock-shutdown-looms-as-democrats-dig-in-against-border-wall-funding/,"TICK TOCK: Shutdown Looms as Democrats  Dig In  Against Border Wall FundingThe federal government hurled towards another potential shut-down Tuesday morning, with congressional Democrats refusing to fund President Trump s signature campaign promise: a physical wall along the US-Mexico border. President Trump and congressional Democrats remain sharply at odds over a spending package as Washington barrels toward a Friday at midnight deadline, leaving some on Capitol Hill increasingly worried that a Christmas government shutdown is in the making,  writes Fox News.President Trump slammed those opposed to the  Border Wall  on social media Tuesday morning, posting  Illegal immigration costs the United States more than 200 Billion Dollars a year. How was this allowed to happen? Illegal immigration costs the United States more than 200 Billion Dollars a year. How was this allowed to happen?  Donald J. Trump (@realDonaldTrump) December 18, 2018Senate Minority Leader Chuck Schumer refused to budge on his party s hardline against securing the southern border, saying  So everyone knows the situation: even with a Republican Congress, no threat or temper tantrum will get the president his wall. "
HANNITY,https://www.hannity.com/media-room/watch-live-president-trump-addresses-the-nation-regarding-government-shutdown/,WATCH LIVE: President Trump Addresses the Nation Regarding Government ShutdownWatch live as President Trump addresses the nation from the White House regarding the ongoing government shutdown Friday afternoon. The Commander-in-Chief s comments come as the budget stalemate finishes its fifth week; becoming the longest shutdown in US history.Watch the President s comments live below:
HANNITY,https://www.hannity.com/media-room/let-me-be-clear-trump-demands-fair-deal-by-feb-15th-or-state-of-emergency/," LET ME BE CLEAR : Trump Demands  Fair Deal  by Feb 15th, Another Shutdown, or  Emergency President Trump officially ended the 35-day long government shutdown Friday; unveiling a deal that re-opens the federal government for three weeks while both parties forge a bipartisan border agreement.The President addressed the nation from the White House lawn, where he warned Congressional leaders to  get a fair deal  by February 15th or he will declare a national emergency along the US-Mexico border.. @realDonaldTrump :  So let me be very clear If we don t get a fair deal from congress, the government either shutdown on February 15th again or I will use the powers afforded to me under the laws, and the constitution of the United States, to address this emergency.  pic.twitter.com/1rqvmmnKp8  Washington Examiner (@dcexaminer) January 25, 2019 So let me be very clear If we don t get a fair deal from congress, the government either shutdown on February 15th again or I will use the powers afforded to me under the laws, and the constitution of the United States, to address this emergency. "
HANNITY,https://www.hannity.com/media-room/youre-grounded-trump-tells-pelosi-to-fly-commercial-during-government-shutdown/,"YOU RE GROUNDED: Trump Tells Pelosi to  Fly Commercial  During Government ShutdownPresident Trump abruptly canceled Speaker Nancy Pelosi s foreign visit Thursday; instructing the leading Democrat to  fly commercial  should she choose to travel overseas. Obviously, if you would like to make your journey by flying commercial, that would certainly be your prerogative,  said the president s statement.President @realDonaldTrump s letter to @SpeakerPelosi concerning her upcoming travel pic.twitter.com/TtBCvwp080  Sarah Sanders (@PressSec) January 17, 2019 I look forward to seeing you soon and even more forward to watching our open and dangerous southern border finally receive the attention, funding, and security it so desperately deserves,  he added."
HANNITY,https://www.hannity.com/media-room/breaking-trump-dems-agree-to-re-open-gov-for-three-weeks-create-border-security-panel/,"BREAKING: Trump, Dems Agree to  Re-Open  Gov for Three Weeks, Create  Border Security  PanelPresident Trump and Congressional leaders have agreed to re-open the federal government for three weeks; paving a path forward for a bipartisan border security panel to craft a comprehensive solution. The deal [ ] wouldn t provide immediate funding for a wall along the U.S.-Mexico border, administration officials said. The deal would fund the government through Feb. 15 and start negotiations between the House and Senate over a full-year bill funding the Homeland Security Department, which oversees the border, aides said,  writes the Wall Street Journal. I am very proud to announce we have reached a deal to end the shutdown and reopen the federal government,  said the President at the White House.The proposed legislation would immediately provide an extension of border security funding at the current level, which features $1.3 billion for protecting the nation s southern border.This is a developing story. Check back for updates."
HANNITY,https://www.hannity.com/media-room/nancy-denied-president-trump-seizes-pelosis-aircraft-cancels-foreign-trip-over-shutdown/,"NANCY DENIED! President Trump Seizes Pelosi s Aircraft, Cancels  Foreign Trip  Over ShutdownPresident Trump abruptly  postponed  Speaker Nancy Pelosi s planned foreign trip Thursday; saying he was  sorry to inform  the left-wing leader that her overseas excursion would be  rescheduled  over the government shutdown. President Trump on Thursday appeared to deny military aircraft to House Speaker Nancy Pelosi for a foreign trip just minutes before the congressional delegation was set to depart, in a stunning response to her call to delay the State of the Union address amid the government shutdown,  writes Fox News. Due to the Shutdown, I am sorry to inform you that your trip to Brussels, Egypt, and Afghanistan has been postponed. We will reschedule this seven-day excursion when the Shutdown is over. In light of the 800,000 great American workers not receiving pay, I am sure you would agree that postponing this public relations event is totally appropriate,  Trump wrote in a letter to Pelosi. I also feel that, during this period, it would be better if you were in Washington negotiating with me and joining the Strong Border Security movement to end the Shutdown. Obviously, if you would like to make your journey by flying commercial, that would certainly be your prerogative,  he added.Read the full report at Fox News."
HANNITY,https://www.hannity.com/media-room/lindsey-graham-declare-national-emergency-if-democrats-say-go-to-hell-on-border-wall/,"LINDSEY GRAHAM: Declare National Emergency if Democrats Say  Go to Hell  on Border WallSen. Lindsey Graham weighed-in Friday on the recent bipartisan agreement to re-open the federal government for three weeks; saying the President should declare a national emergency should Democrats fail to live-up to their end of the bargain. Come February the 15th, if the Democrats still say:  Go to hell on the wall, you get a dollar, that s it.  They basically tell Trump,  I m not going to do with you what I did with Bush and Obama,  then I hope he will go the emergency route,  said Graham following the president s address. We don t need to shut the government down, we need to secure the border,  Graham said.  And to me, the last best chance to do this win-win is between now and Feb. 15. The President presented Congressional leaders with three options Friday: Reach a  fair deal  by February 15th, face another government shutdown, or prompt Trump to declare a  national emergency  along the southern border.Read the full story at the Washington Examiner."
HANNITY,https://www.hannity.com/media-room/nancys-nightmare-pelosis-poll-numbers-plunge-after-shutdown/,"NANCY S NIGHTMARE: Pelosi s Poll Numbers PLUNGE After ShutdownA new NBC News / Wall Street Journal Poll shows big trouble for the recently sworn-in Speaker of the House; revealing Nancy Pelosi s approval ratings significantly dropped after the five-week long government shutdown. Pelosi s approval rate dropped by six points during the 35-day government shutdown, as 47 percent of Americans surveyed rated Pelosi as  very negative,  while only 28 percent rated her favorably,  writes the Daily Caller. President Trump s standing among Americans remained effectively unchanged even as he presided over the longest partial government shutdown in U.S. history, the latest example of how his unusual brand of politics has resonated with a strong core of supporters,  adds the survey.The poll comes just days before Speaker Pelosi and Congressional Democrats face a hard-deadline to pass a bipartisan budget agreement; setting the stage for another potential shutdown should they fail to fully fund the president s border security proposals.Read the full report here."
HANNITY,https://www.hannity.com/media-room/breaking-now-president-trump-offers-immigration-compromise-to-re-open-government/,"BREAKING NOW: President Trump Offers Immigration Compromise to Re-Open GovernmentPresident Trump addressed the American people from the White House Saturday afternoon; detailing his new effort to secure the US-Mexico border and re-open the federal government after weeks of a partial government shutdown. President Trump, in a televised White House address Saturday, offered Democrats a compromise package on immigration in an effort to end the nearly monthlong partial government shutdown   although Democrats dismissed the olive branch as a  non-starter  before Trump even spoke,  writes Fox News. Trump said that he was prepared to back a three-year extension of protections for 700,000 immigrants who came to the country illegally as children and were shielded from deportation under the Obama-era Deferred Action for Childhood Arrivals (DACA) program, in exchange for the $5.7 billion he has requested for a wall on the southern border. The deal would also extend protections for 300,000 recipients of the Temporary Protected Status (TPS) program   which protects immigrants from designated countries with conditions that prevent nationals from returning safely,  adds the author.Read the full report here."
